{
  "$schema": "../../schema/ctl-template-1.schema.json",
  "schema": "acmp-ctl/template@1",
  "id": "gpo-cache-loeschen",
  "version": "1.1.0",
  "status": "entwurf",
  "name": "GPO-Cache löschen und Richtlinien neu laden",
  "summary": "Löscht den lokalen Gruppenrichtlinien-Cache (GroupPolicy, GroupPolicyUsers, Registry.pol) und lädt die Richtlinien mit gpupdate /force neu. Hilft, wenn ein Client alte oder fehlerhafte GPO-Einstellungen festhält. Lokal gesetzte Richtlinien (gpedit.msc) gehen dabei verloren.",
  "description": "### So funktioniert es\n1. Löscht die `Registry.pol`-Dateien und die Ordner `GroupPolicy` und `GroupPolicyUsers` unter `C:\\Windows\\System32`.\n2. Löscht den GPO-Cache im Profil des ausführenden Kontos (`AppData\\Local\\Microsoft\\GroupPolicy`). Als SYSTEM ist das das Profil von SYSTEM.\n3. `gpupdate /force` lädt die Richtlinien neu. Fragt gpupdate nach Abmelden oder Neustart, antwortet das Skript mit N. Es meldet niemanden ab und startet nichts neu.\n\n### Ergebnis und Exitcodes\nDer Exitcode steht in `GPO_EXITCODE`. Ist er nicht 0, endet der Command mit Fehler.\n- `0` gelöscht und Richtlinien neu geladen\n- `2` mindestens ein Ordner oder eine Datei ließ sich nicht löschen, gpupdate lief trotzdem\n- `3` gpupdate meldet einen Fehler\n- `1` sonstiger Fehler\n\nOb die Richtlinien wieder greifen, zeigt `gpresult /r` auf dem Client.\n\n### Hinweise\n- In den gelöschten Ordnern liegt auch die lokale Gruppenrichtlinie (gpedit.msc, LGPO). Lokal gesetzte Richtlinien sind danach weg und kommen nicht zurück. Auf Rechnern ohne Domäne bleibt dann keine Richtlinie übrig.\n- Domänenrichtlinien lädt `gpupdate /force` sofort neu. Dafür braucht der Client Verbindung zu einem Domänencontroller.\n- Richtlinien, die eine Abmeldung oder einen Neustart brauchen (z. B. Softwareinstallation per GPO), greifen erst bei der nächsten Anmeldung oder dem nächsten Start.",
  "author": {
    "name": "herzog GmbH",
    "github": "Herzog-GmbH"
  },
  "license": "MIT",
  "updated": "2026-10-16",
  "category": "Wartung",
  "tags": [
    "GPO",
    "Gruppenrichtlinien",
    "gpupdate",
    "Registry.pol",
    "Active Directory"
  ],
  "applications": [
    {
      "name": "Gruppenrichtlinien (GPO)",
      "vendor": "Microsoft"
    }
  ],
  "acmp": {
    "minVersion": "6.10",
    "scriptFormat": 13,
    "exportedWith": "6.10.4"
  },
  "parameters": [],
  "requires": {
    "customFields": [],
    "globalAccount": null,
    "notes": [
      "Läuft als Dienst (SYSTEM). Der GPO-Cache im Benutzerprofil ist deshalb der von SYSTEM, nicht der des angemeldeten Benutzers.",
      "Nach dem Lauf wendet der Client alle Richtlinien neu an. Benutzerrichtlinien greifen teilweise erst nach der nächsten Anmeldung.",
      "Vorsicht bei Rechnern mit lokal gesetzten Richtlinien (gpedit.msc, LGPO, Sicherheitsvorlagen): Diese Einstellungen löscht der Command mit.",
      "Kein Neustart, keine Abmeldung."
    ]
  },
  "variables": [
    {
      "name": "GPO_EXITCODE",
      "value": "-1"
    }
  ],
  "steps": [
    {
      "class": "TExecutePowerShell",
      "description": "GPO-Cache löschen und Richtlinien mit gpupdate /force neu laden (PowerShell)",
      "summary": "GroupPolicy, GroupPolicyUsers und den GPO-Cache im Profil löschen, dann gpupdate /force (Rückfragen werden mit N beantwortet)",
      "fields": {
        "_CommandComment": "Läuft als SYSTEM. Rückgabe in GPO_EXITCODE: 0 gelöscht und neu geladen; 2 nicht alles gelöscht; 3 gpupdate meldet Fehler; 1 sonstiger Fehler.",
        "BatchLines": [
          "# GPO-Cache loeschen und Gruppenrichtlinien neu laden",
          "# ACMP CTL, Vorlage gpo-cache-loeschen. Laeuft als SYSTEM (64-Bit-PowerShell).",
          "# Keine Prozentzeichen verwenden: ACMP ersetzt sie durch Projektvariablen.",
          "#",
          "# Loescht C:\\Windows\\System32\\GroupPolicy und GroupPolicyUsers (mit den Registry.pol-Dateien) und den",
          "# GPO-Cache im Profil des ausfuehrenden Kontos (als SYSTEM das Profil von SYSTEM). In diesen Ordnern liegt",
          "# auch die lokale Gruppenrichtlinie (gpedit.msc, LGPO), sie ist danach weg.",
          "# Danach gpupdate /force. Fragt gpupdate nach Abmelden oder Neustart, antwortet das Skript mit N.",
          "#",
          "# Rueckgabe: 0 geloescht und Richtlinien neu geladen",
          "#            2 mindestens ein Ordner oder eine Datei liess sich nicht loeschen (gpupdate lief trotzdem)",
          "#            3 gpupdate meldet einen Fehler",
          "#            1 sonstiger Fehler",
          "",
          "$ErrorActionPreference = 'Stop'",
          "function Melde([string]$text) { [Console]::Out.WriteLine($text) }",
          "trap { Melde ('FEHLER 1: ' + $_.Exception.Message); exit 1 }",
          "",
          "if (-not $env:windir) { Melde 'FEHLER 1: Umgebungsvariable windir fehlt.'; exit 1 }",
          "$sys32 = Join-Path $env:windir 'System32'",
          "$gpupdate = Join-Path $sys32 'gpupdate.exe'",
          "if (-not (Test-Path -LiteralPath $gpupdate -PathType Leaf)) { Melde ('FEHLER 1: gpupdate.exe fehlt in ' + $sys32); exit 1 }",
          "",
          "$dateien = @((Join-Path $sys32 'GroupPolicy\\Machine\\Registry.pol'), (Join-Path $sys32 'GroupPolicy\\User\\Registry.pol'))",
          "$ordner = @((Join-Path $sys32 'GroupPolicy'), (Join-Path $sys32 'GroupPolicyUsers'))",
          "if ($env:LOCALAPPDATA) { $ordner += (Join-Path $env:LOCALAPPDATA 'Microsoft\\GroupPolicy') }",
          "",
          "# 1. Registry.pol und Ordner loeschen",
          "$rest = 0",
          "foreach ($d in $dateien) {",
          "    if (-not (Test-Path -LiteralPath $d -PathType Leaf)) { continue }",
          "    try { Remove-Item -LiteralPath $d -Force -ErrorAction Stop; Melde ('Geloescht: ' + $d) }",
          "    catch { $rest++; Melde ('Nicht loeschbar: ' + $d + ' (' + $_.Exception.Message + ')') }",
          "}",
          "foreach ($o in $ordner) {",
          "    if (-not (Test-Path -LiteralPath $o -PathType Container)) { Melde ('Nicht vorhanden: ' + $o); continue }",
          "    try { Remove-Item -LiteralPath $o -Recurse -Force -ErrorAction Stop; Melde ('Geloescht: ' + $o) }",
          "    catch { $rest++; Melde ('Nicht ganz geloescht: ' + $o + ' (' + $_.Exception.Message + ')') }",
          "}",
          "",
          "# 2. gpupdate /force. Rueckfragen zu Abmelden und Neustart bekommen ein N (wie echo N | gpupdate /force).",
          "# Stop gilt hier nicht: in Windows PowerShell 5.1 wuerde sonst jede stderr-Zeile von gpupdate abbrechen.",
          "Melde 'gpupdate /force ...'",
          "$ErrorActionPreference = 'Continue'",
          "$ausgabe = @(@('N', 'N') | & $gpupdate /force 2>&1 | ForEach-Object { ([string]$_).Trim() } | Where-Object { $_ })",
          "$code = $LASTEXITCODE",
          "$ErrorActionPreference = 'Stop'",
          "foreach ($z in @($ausgabe | Select-Object -Last 4)) { Melde ('  ' + $z) }",
          "if ($code -ne 0) { Melde ('FEHLER 3: gpupdate meldet Code ' + $code + '.'); exit 3 }",
          "if ($rest -gt 0) { Melde ('FEHLER 2: ' + $rest + ' Ordner oder Dateien liessen sich nicht loeschen.'); exit 2 }",
          "Melde 'Fertig.'",
          "exit 0"
        ],
        "ExitCode": "GPO_EXITCODE",
        "OutputLines": "",
        "ShowConsole": "False",
        "Use64Bit": "True",
        "RunAsGlobalAccount": "False",
        "RunAsDifferentUser": "False",
        "RunAsRequestElevatedRights": "False",
        "RunAsGlobalAccountId": "",
        "RunAsUsername": "",
        "RunAsPassword": ""
      }
    },
    {
      "class": "TActionIf",
      "description": "Wenn das Skript einen Fehler meldet",
      "summary": "GPO_EXITCODE ungleich 0",
      "fields": {
        "Value_1": "%GPO_EXITCODE%",
        "Value_2": "0",
        "Operator": "<>",
        "CaseSensitive": "False",
        "DigitsAsNumbers": "False"
      },
      "children": [
        {
          "class": "TActionExitScript",
          "description": "Command mit Fehler beenden",
          "summary": "Ergebnis: Fehler",
          "fields": {
            "Result": "1",
            "Reason": "GPO-Cache: Code %GPO_EXITCODE% (2 = nicht alles gelöscht, 3 = gpupdate meldet Fehler, 1 = sonstiger Fehler). Details im Schritt-Protokoll."
          }
        }
      ]
    }
  ],
  "files": []
}
